{"$id":"https://quiz-app.local/schemas/question.json","$schema":"http://json-schema.org/draft-07/schema#","additionalProperties":false,"allOf":[{"description":"Mỗi câu hỏi phải có ít nhất 1 đáp án đúng.","if":{"type":"object"},"then":{"type":"object"}}],"description":"Schema dữ liệu một câu hỏi trắc nghiệm sau khi parse từ Markdown. Chốt bởi Skill 04.","properties":{"answerKey":{"description":"Nguyên văn dòng 'The correct answer is: ...' / 'The correct answers are: ...'. CHỈ dùng để cross-check nội bộ, không hiển thị ra UI.","type":"string"},"deck":{"description":"Bộ câu hỏi: review = ôn tập (File A), exam1/exam2 = đề thi thử 1/2 (File B).","enum":["review","exam1","exam2"],"type":"string"},"explanation":{"description":"Giải thích chi tiết từ khối blockquote (Markdown, đã loại bỏ dòng 'Chính xác!' và dòng ground-truth).","type":"string"},"id":{"description":"Định danh duy nhất toàn cục. Định dạng: {deck}-{number padded 3}. Ví dụ: review-001, exam1-040, exam2-007.","pattern":"^(review|exam1|exam2)-[0-9]{3}$","type":"string"},"number":{"description":"Số thứ tự câu hỏi trong deck (1..40).","minimum":1,"type":"integer"},"options":{"description":"Danh sách lựa chọn theo đúng thứ tự trong nguồn. Số lượng không cố định.","items":{"additionalProperties":false,"properties":{"isCorrect":{"description":"true nếu dòng option gốc có dấu ✅ ở cuối.","type":"boolean"},"key":{"description":"Ký hiệu lựa chọn, chữ cái thường: a, b, c, ...","pattern":"^[a-z]$","type":"string"},"note":{"description":"Ghi chú ngắn trong *(...)* đi kèm ✅; null nếu không có.","type":["string","null"]},"text":{"description":"Nội dung lựa chọn (đã loại bỏ hậu tố ✅ và ghi chú).","minLength":1,"type":"string"}},"required":["key","text","isCorrect","note"],"type":"object"},"minItems":2,"type":"array"},"stem":{"description":"Thân câu hỏi, giữ nguyên Markdown gốc (có thể chứa bảng, in đậm/nghiêng, code inline).","minLength":1,"type":"string"},"type":{"description":"single = 'Select one' (chọn 1), multiple = 'Select one or more' (chọn nhiều).","enum":["single","multiple"],"type":"string"}},"required":["id","deck","number","type","stem","options","explanation","answerKey"],"title":"Question","type":"object"}