[
  {
    "id": "review-001",
    "deck": "review",
    "number": 1,
    "type": "multiple",
    "stem": "Chọn **HAI** tình huống là **rủi ro sản phẩm** (Product Risk).",
    "options": [
      {
        "key": "a",
        "text": "Hệ thống tính sai tiền học phí của sinh viên",
        "isCorrect": true,
        "note": "(Đúng – ảnh hưởng đến chất lượng của chính phần mềm.)"
      },
      {
        "key": "b",
        "text": "Dữ liệu thẻ thanh toán của khách hàng có thể bị rò rỉ",
        "isCorrect": true,
        "note": "(Đúng – ảnh hưởng đến chất lượng của chính phần mềm.)"
      },
      {
        "key": "c",
        "text": "Khách hàng liên tục thay đổi yêu cầu",
        "isCorrect": false,
        "note": null
      },
      {
        "key": "d",
        "text": "Môi trường kiểm thử bàn giao trễ 2 tuần",
        "isCorrect": false,
        "note": null
      },
      {
        "key": "e",
        "text": "Tester chủ chốt nghỉ việc giữa dự án",
        "isCorrect": false,
        "note": null
      }
    ],
    "explanation": "Rủi ro dự án ảnh hưởng khả năng hoàn thành dự án đúng hạn; rủi ro sản phẩm ảnh hưởng chất lượng phần mềm. Rủi ro = Xác suất × Mức độ ảnh hưởng.",
    "answerKey": "The correct answers are: Hệ thống tính sai tiền học phí của sinh viên, Dữ liệu thẻ thanh toán của khách hàng có thể bị rò rỉ"
  },
  {
    "id": "review-002",
    "deck": "review",
    "number": 2,
    "type": "single",
    "stem": "Cho trích đoạn ma trận truy vết yêu cầu (RTM):\n\n| Mã YC | Mô tả | Test Case |\n|-------|-------|-----------|\n| REQ-01 | Đăng nhập bằng email | TC-01, TC-02 |\n| REQ-02 | Khóa tài khoản sau 3 lần sai | TC-03 |\n| REQ-03 | Đổi mật khẩu | (trống) |\n\nThông tin quan trọng nhất mà RTM này cho thấy là gì?",
    "options": [
      {
        "key": "a",
        "text": "TC-03 không truy vết được về yêu cầu nào",
        "isCorrect": false,
        "note": null
      },
      {
        "key": "b",
        "text": "Hệ thống đã sẵn sàng phát hành",
        "isCorrect": false,
        "note": null
      },
      {
        "key": "c",
        "text": "REQ-03 chưa được kiểm thử – có lỗ hổng bao phủ yêu cầu",
        "isCorrect": true,
        "note": "(Chính xác. RTM giúp phát hiện yêu cầu chưa có Test Case.)"
      },
      {
        "key": "d",
        "text": "REQ-01 bị kiểm thử thừa vì có 2 Test Case",
        "isCorrect": false,
        "note": null
      }
    ],
    "explanation": "RTM trả lời: mọi yêu cầu đã có Test Case chưa (độ bao phủ) và Test Case kiểm tra yêu cầu nào (truy vết ngược).",
    "answerKey": "The correct answer is: REQ-03 chưa được kiểm thử – có lỗ hổng bao phủ yêu cầu"
  },
  {
    "id": "review-003",
    "deck": "review",
    "number": 3,
    "type": "single",
    "stem": "Với yêu cầu 18 ≤ Tuổi ≤ 60 (Tuổi là số nguyên), áp dụng Phân tích giá trị biên theo phương pháp **2 giá trị** (ISTQB), tập giá trị kiểm thử nào là **ĐÚNG**?",
    "options": [
      {
        "key": "a",
        "text": "15, 30, 65",
        "isCorrect": false,
        "note": null
      },
      {
        "key": "b",
        "text": "18, 60",
        "isCorrect": false,
        "note": null
      },
      {
        "key": "c",
        "text": "17, 18, 60, 61",
        "isCorrect": true,
        "note": "(Chính xác: mỗi biên lấy giá trị trên biên và giá trị liền kề phía ngoài vùng.)"
      },
      {
        "key": "d",
        "text": "17, 18, 19, 59, 60, 61",
        "isCorrect": false,
        "note": null
      }
    ],
    "explanation": "BVA 2 giá trị: tại mỗi biên chọn giá trị ngay trên biên và giá trị liền kề thuộc phân vùng bên cạnh → 17, 18, 60, 61.",
    "answerKey": "The correct answer is: 17, 18, 60, 61"
  },
  {
    "id": "review-004",
    "deck": "review",
    "number": 4,
    "type": "single",
    "stem": "Yêu cầu: *Nhập sai mã PIN 3 lần thì khóa tài khoản; nhập đúng PIN thì đăng nhập thành công.* Hệ thống bắt đầu ở trạng thái S1 (Chờ nhập PIN). Người dùng thực hiện chuỗi sự kiện: **Sai → Sai → Đúng**. Trạng thái cuối cùng mong đợi là gì?",
    "options": [
      {
        "key": "a",
        "text": "S3: Đăng nhập thành công",
        "isCorrect": true,
        "note": "(Chính xác. Sau 2 lần sai hệ thống vẫn ở S1; lần nhập đúng chuyển sang S3.)"
      },
      {
        "key": "b",
        "text": "S1: Chờ nhập PIN",
        "isCorrect": false,
        "note": null
      },
      {
        "key": "c",
        "text": "Trạng thái không hợp lệ",
        "isCorrect": false,
        "note": null
      },
      {
        "key": "d",
        "text": "S2: Bị khóa",
        "isCorrect": false,
        "note": null
      }
    ],
    "explanation": "S1 --Sai lần 1, 2--> S1; S1 --Sai lần 3--> S2 (Khóa); S1 --Đúng PIN--> S3 (Thành công).",
    "answerKey": "The correct answer is: S3: Đăng nhập thành công"
  },
  {
    "id": "review-005",
    "deck": "review",
    "number": 5,
    "type": "multiple",
    "stem": "Chọn **HAI** trường hợp **KHÔNG NÊN** tự động hóa kiểm thử.",
    "options": [
      {
        "key": "a",
        "text": "Kiểm thử tải (Load test) với 5.000 người dùng ảo",
        "isCorrect": false,
        "note": null
      },
      {
        "key": "b",
        "text": "Đánh giá tính dễ sử dụng (Usability) của giao diện mới",
        "isCorrect": true,
        "note": "(Đúng – Usability cần đánh giá của con người.)"
      },
      {
        "key": "c",
        "text": "Test Case chỉ chạy đúng một lần",
        "isCorrect": true,
        "note": "(Đúng – chi phí viết script không được bù đắp.)"
      },
      {
        "key": "d",
        "text": "Bộ Test Case hồi quy chạy lại sau mỗi lần commit",
        "isCorrect": false,
        "note": null
      },
      {
        "key": "e",
        "text": "Tạo dữ liệu kiểm thử hàng loạt",
        "isCorrect": false,
        "note": null
      }
    ],
    "explanation": "Nên tự động: hồi quy, happy path cốt lõi, hiệu năng/tải, setup dữ liệu. Không nên: TC chạy 1 lần, UI thay đổi liên tục, Usability, Exploratory.",
    "answerKey": "The correct answers are: Đánh giá tính dễ sử dụng (Usability) của giao diện mới, Test Case chỉ chạy đúng một lần"
  },
  {
    "id": "review-006",
    "deck": "review",
    "number": 6,
    "type": "single",
    "stem": "Yêu cầu: *Chỉ người từ 18 đến 60 tuổi (tính cả 18 và 60) mới được cấp bằng lái.* Áp dụng kỹ thuật Phân vùng tương đương (EP) cho đầu vào Tuổi, cần **tối thiểu** bao nhiêu Test Case để bao phủ tất cả các phân vùng?",
    "options": [
      {
        "key": "a",
        "text": "3",
        "isCorrect": true,
        "note": "(Chính xác: 1 vùng hợp lệ (18–60) và 2 vùng không hợp lệ (<18 và >60).)"
      },
      {
        "key": "b",
        "text": "43",
        "isCorrect": false,
        "note": null
      },
      {
        "key": "c",
        "text": "4",
        "isCorrect": false,
        "note": null
      },
      {
        "key": "d",
        "text": "2",
        "isCorrect": false,
        "note": null
      }
    ],
    "explanation": "Ba phân vùng: Tuổi < 18 (Invalid), 18 ≤ Tuổi ≤ 60 (Valid), Tuổi > 60 (Invalid). Mỗi vùng chọn 1 giá trị đại diện.",
    "answerKey": "The correct answer is: 3"
  },
  {
    "id": "review-007",
    "deck": "review",
    "number": 7,
    "type": "single",
    "stem": "Thống kê cho thấy phần lớn lỗi của một hệ thống bán hàng nằm trong module Thanh toán và module Khuyến mãi. Trưởng nhóm kiểm thử quyết định tăng cường Test Case cho hai module này ở đợt kiểm thử tiếp theo. Quyết định trên dựa chủ yếu vào nguyên lý nào?",
    "options": [
      {
        "key": "a",
        "text": "Sự tập trung của lỗi (Quy tắc 80/20)",
        "isCorrect": true,
        "note": "(Chính xác. Phần lớn lỗi thường nằm trong một số ít module, nên cần tập trung nỗ lực kiểm thử vào đó.)"
      },
      {
        "key": "b",
        "text": "Kiểm thử phụ thuộc ngữ cảnh",
        "isCorrect": false,
        "note": null
      },
      {
        "key": "c",
        "text": "Sự sai lầm về việc không có lỗi",
        "isCorrect": false,
        "note": null
      },
      {
        "key": "d",
        "text": "Kiểm thử cho thấy sự hiện diện của lỗi",
        "isCorrect": false,
        "note": null
      }
    ],
    "explanation": "Nguyên lý 4 – Sự tập trung của lỗi: khoảng 80% bug thường nằm trong 20% module.",
    "answerKey": "The correct answer is: Sự tập trung của lỗi (Quy tắc 80/20)"
  },
  {
    "id": "review-008",
    "deck": "review",
    "number": 8,
    "type": "single",
    "stem": "Một lập trình viên hiểu sai yêu cầu nên viết điều kiện giảm giá sai trong mã nguồn. Khi khách hàng thanh toán, hệ thống hiển thị sai số tiền. Trình tự nào mô tả **ĐÚNG** mối quan hệ giữa các khái niệm?",
    "options": [
      {
        "key": "a",
        "text": "Failure (hiểu sai yêu cầu) → Defect (điều kiện sai trong code) → Error (hiển thị sai số tiền)",
        "isCorrect": false,
        "note": null
      },
      {
        "key": "b",
        "text": "Error (hiểu sai yêu cầu) → Failure (điều kiện sai trong code) → Defect (hiển thị sai số tiền)",
        "isCorrect": false,
        "note": null
      },
      {
        "key": "c",
        "text": "Defect (hiểu sai yêu cầu) → Error (điều kiện sai trong code) → Failure (hiển thị sai số tiền)",
        "isCorrect": false,
        "note": null
      },
      {
        "key": "d",
        "text": "Error (hiểu sai yêu cầu) → Defect (điều kiện sai trong code) → Failure (hiển thị sai số tiền)",
        "isCorrect": true,
        "note": "(Chính xác. Hành động sai của con người tạo ra khiếm khuyết, khiếm khuyết khi thực thi gây ra thất bại.)"
      }
    ],
    "explanation": "Error (hành động của con người) → Defect/Bug (nằm trong code/tài liệu) → Failure (sự kiện khi thực thi).",
    "answerKey": "The correct answer is: Error (hiểu sai yêu cầu) → Defect (điều kiện sai trong code) → Failure (hiển thị sai số tiền)"
  },
  {
    "id": "review-009",
    "deck": "review",
    "number": 9,
    "type": "single",